{
  "$schema": "https://json-schema.org/draft/2020-12/schema",
  "$id": "https://dexa.art/learnmap/schema/secondary/bridge-profile.schema.json",
  "title": "Korean Secondary Learning Map — middle-to-high transition bridge profile",
  "$ref": "#/$defs/release",
  "$defs": {
    "release": {
      "type": "object",
      "required": [
        "$schema",
        "releaseId",
        "profile",
        "curriculumVersion",
        "status",
        "createdDate",
        "middleReleaseId",
        "highReleaseId",
        "sourceManifest",
        "rightsStatus",
        "collections",
        "counts"
      ],
      "properties": {
        "$schema": {
          "type": "string",
          "format": "uri-reference"
        },
        "releaseId": {
          "type": "string",
          "pattern": "^kr-2022-middle-high-bridge-v[0-9]+\\.[0-9]+(?:\\.[0-9]+)?(?:-[a-z0-9.-]+)?$"
        },
        "profile": {
          "const": "bridges"
        },
        "curriculumVersion": {
          "const": "2022-revised"
        },
        "status": {
          "enum": [
            "design-skeleton",
            "candidate",
            "formal-release",
            "stale"
          ]
        },
        "createdDate": {
          "type": "string",
          "format": "date"
        },
        "middleReleaseId": {
          "type": "string",
          "pattern": "^kr-2022-middle-v"
        },
        "highReleaseId": {
          "type": "string",
          "pattern": "^kr-2022-high-v"
        },
        "sourceManifest": {
          "type": "string",
          "pattern": "^\\.\\./shared/[^/]+\\.json$"
        },
        "rightsStatus": {
          "$ref": "core.schema.json#/$defs/rightsStatus"
        },
        "collections": {
          "type": "object",
          "required": [
            "transitionAlignments",
            "reviewRecords",
            "coverageGaps"
          ],
          "properties": {
            "transitionAlignments": {
              "const": "transition-alignments.json"
            },
            "reviewRecords": {
              "const": "review-records.json"
            },
            "coverageGaps": {
              "const": "coverage-gaps.json"
            },
            "elementaryTransitions": {
              "const": "elementary-transitions.json"
            },
            "candidateElementaryTransitions": {
              "const": "elementary-transitions.candidate.json"
            }
          },
          "additionalProperties": false
        },
        "counts": {
          "type": "object",
          "required": [
            "transitionAlignments",
            "reviewRecords",
            "coverageGaps"
          ],
          "properties": {
            "transitionAlignments": {
              "type": "integer",
              "minimum": 0
            },
            "reviewRecords": {
              "type": "integer",
              "minimum": 0
            },
            "coverageGaps": {
              "type": "integer",
              "minimum": 0
            },
            "elementaryTransitions": {
              "type": "integer",
              "minimum": 0
            },
            "candidateElementaryTransitions": {
              "type": "integer",
              "minimum": 0
            }
          },
          "additionalProperties": false
        }
      },
      "additionalProperties": false
    },
    "transitionAlignment": {
      "type": "object",
      "required": [
        "id",
        "fromSchoolLevel",
        "toSchoolLevel",
        "fromCourseIds",
        "fromTopicIds",
        "toCourseIds",
        "toTopicIds",
        "transitionKind",
        "reason",
        "basisKind",
        "basis",
        "sourceRefs",
        "reviewStatus"
      ],
      "properties": {
        "id": {
          "$ref": "core.schema.json#/$defs/stableId"
        },
        "fromSchoolLevel": {
          "const": "middle"
        },
        "toSchoolLevel": {
          "const": "high"
        },
        "fromCourseIds": {
          "type": "array",
          "minItems": 1,
          "uniqueItems": true,
          "items": {
            "$ref": "core.schema.json#/$defs/stableId"
          }
        },
        "fromTopicIds": {
          "type": "array",
          "uniqueItems": true,
          "items": {
            "$ref": "core.schema.json#/$defs/stableId"
          }
        },
        "toCourseIds": {
          "type": "array",
          "uniqueItems": true,
          "items": {
            "$ref": "core.schema.json#/$defs/stableId"
          }
        },
        "toTopicIds": {
          "type": "array",
          "uniqueItems": true,
          "items": {
            "$ref": "core.schema.json#/$defs/stableId"
          }
        },
        "transitionKind": {
          "enum": [
            "continues",
            "deepens",
            "prepares-for"
          ]
        },
        "reason": {
          "type": "string",
          "minLength": 1
        },
        "basisKind": {
          "const": "official-source"
        },
        "basis": {
          "type": "string",
          "minLength": 1
        },
        "sourceRefs": {
          "type": "array",
          "minItems": 1,
          "uniqueItems": true,
          "items": {
            "$ref": "core.schema.json#/$defs/sourceRef"
          }
        },
        "reviewStatus": {
          "$ref": "core.schema.json#/$defs/reviewStatus"
        }
      },
      "anyOf": [
        {
          "properties": {
            "toCourseIds": {
              "minItems": 1
            }
          }
        },
        {
          "properties": {
            "toTopicIds": {
              "minItems": 1
            }
          }
        }
      ],
      "additionalProperties": false
    },
    "transitionAlignmentCollection": {
      "allOf": [
        {
          "$ref": "core.schema.json#/$defs/collectionEnvelopeBase"
        },
        {
          "properties": {
            "profile": {
              "const": "bridges"
            },
            "recordType": {
              "const": "transitionAlignments"
            },
            "records": {
              "items": {
                "$ref": "#/$defs/transitionAlignment"
              }
            }
          }
        }
      ],
      "unevaluatedProperties": false
    },
    "reviewRecordCollection": {
      "allOf": [
        {
          "$ref": "core.schema.json#/$defs/collectionEnvelopeBase"
        },
        {
          "properties": {
            "profile": {
              "const": "bridges"
            },
            "recordType": {
              "const": "reviewRecords"
            },
            "records": {
              "items": {
                "$ref": "core.schema.json#/$defs/reviewRecord"
              }
            }
          }
        }
      ],
      "unevaluatedProperties": false
    },
    "coverageGapCollection": {
      "allOf": [
        {
          "$ref": "core.schema.json#/$defs/collectionEnvelopeBase"
        },
        {
          "properties": {
            "profile": {
              "const": "bridges"
            },
            "recordType": {
              "const": "coverageGaps"
            },
            "records": {
              "items": {
                "$ref": "core.schema.json#/$defs/coverageGap"
              }
            }
          }
        }
      ],
      "unevaluatedProperties": false
    },
    "elementaryTransition": {
      "type": "object",
      "required": [
        "id",
        "dependentTopicId",
        "prerequisiteTopicId",
        "layer",
        "relationKind",
        "scope",
        "strength",
        "reason",
        "basisKind",
        "basis",
        "sourceRefs",
        "reviewStatus"
      ],
      "properties": {
        "id": {
          "$ref": "core.schema.json#/$defs/stableId"
        },
        "dependentTopicId": {
          "$ref": "core.schema.json#/$defs/stableId"
        },
        "prerequisiteTopicId": {
          "$ref": "core.schema.json#/$defs/elementaryTopicId"
        },
        "layer": {
          "const": "official"
        },
        "relationKind": {
          "enum": [
            "required-prerequisite",
            "recommended-before"
          ]
        },
        "scope": {
          "const": "cross-school-level"
        },
        "strength": {
          "enum": [
            "required",
            "recommended"
          ]
        },
        "reason": {
          "type": "string",
          "minLength": 1
        },
        "basisKind": {
          "const": "official-source"
        },
        "basis": {
          "type": "string",
          "minLength": 1
        },
        "sourceRefs": {
          "type": "array",
          "minItems": 1,
          "uniqueItems": true,
          "items": {
            "$ref": "core.schema.json#/$defs/sourceRef"
          }
        },
        "reviewStatus": {
          "$ref": "core.schema.json#/$defs/reviewStatus"
        }
      },
      "allOf": [
        {
          "if": {
            "properties": {
              "relationKind": {
                "const": "required-prerequisite"
              }
            }
          },
          "then": {
            "properties": {
              "basisKind": {
                "const": "official-source"
              },
              "strength": {
                "const": "required"
              }
            }
          }
        }
      ],
      "additionalProperties": false,
      "description": "초등(korean-elementary-learning-map) 토픽을 선수로 갖는 중학교 토픽의 학교급 간 학습 관계. prerequisiteTopicId는 elementary-topic-inventory.json에 핀된 초등 토픽 ID다."
    },
    "candidateElementaryTransition": {
      "type": "object",
      "description": "K-12 공통 계약 v1의 pedagogical-candidate 층 초→중 전이. 공식 문서가 명시한 선수 관계가 아니라 내용 체계표의 영역 연속(R-DOMAIN-CONTINUITY)에서 도출한 권장 학습 순서다.",
      "required": [
        "id",
        "dependentTopicId",
        "prerequisiteTopicId",
        "layer",
        "relationKind",
        "scope",
        "strength",
        "reason",
        "basisKind",
        "basis",
        "sourceRefs",
        "reviewStatus"
      ],
      "properties": {
        "id": {
          "$ref": "core.schema.json#/$defs/stableId"
        },
        "dependentTopicId": {
          "$ref": "core.schema.json#/$defs/stableId"
        },
        "prerequisiteTopicId": {
          "$ref": "core.schema.json#/$defs/elementaryTopicId"
        },
        "layer": {
          "const": "pedagogical-candidate"
        },
        "relationKind": {
          "const": "recommended-before"
        },
        "scope": {
          "const": "cross-school-level"
        },
        "strength": {
          "const": "recommended"
        },
        "reason": {
          "type": "string",
          "minLength": 1
        },
        "basisKind": {
          "enum": [
            "official-code-order",
            "decomposition-order",
            "repository-authored"
          ]
        },
        "basis": {
          "type": "string",
          "minLength": 1
        },
        "sourceRefs": {
          "type": "array",
          "minItems": 1,
          "uniqueItems": true,
          "items": {
            "$ref": "core.schema.json#/$defs/sourceRef"
          }
        },
        "reviewStatus": {
          "const": "candidate"
        }
      },
      "additionalProperties": false
    },
    "candidateElementaryTransitionCollection": {
      "allOf": [
        {
          "$ref": "core.schema.json#/$defs/collectionEnvelopeBase"
        },
        {
          "properties": {
            "profile": {
              "const": "bridges"
            },
            "recordType": {
              "const": "candidateElementaryTransitions"
            },
            "elementaryReleaseVersion": {
              "type": "string",
              "minLength": 1
            },
            "records": {
              "items": {
                "$ref": "#/$defs/candidateElementaryTransition"
              }
            }
          },
          "required": [
            "elementaryReleaseVersion"
          ]
        }
      ],
      "unevaluatedProperties": false
    },
    "elementaryTransitionCollection": {
      "allOf": [
        {
          "$ref": "core.schema.json#/$defs/collectionEnvelopeBase"
        },
        {
          "properties": {
            "profile": {
              "const": "bridges"
            },
            "recordType": {
              "const": "elementaryTransitions"
            },
            "elementaryReleaseVersion": {
              "type": "string",
              "minLength": 1
            },
            "records": {
              "items": {
                "$ref": "#/$defs/elementaryTransition"
              }
            }
          },
          "required": [
            "elementaryReleaseVersion"
          ]
        }
      ],
      "unevaluatedProperties": false
    }
  }
}
