{
  "$schema": "../../../schema/bridge-profile.schema.json",
  "collections": {
    "candidateElementaryTransitions": "elementary-transitions.candidate.json",
    "coverageGaps": "coverage-gaps.json",
    "elementaryTransitions": "elementary-transitions.json",
    "reviewRecords": "review-records.json",
    "transitionAlignments": "transition-alignments.json"
  },
  "counts": {
    "candidateElementaryTransitions": 3180,
    "coverageGaps": 1,
    "elementaryTransitions": 290,
    "reviewRecords": 1,
    "transitionAlignments": 175
  },
  "createdDate": "2026-07-13",
  "curriculumVersion": "2022-revised",
  "highReleaseId": "kr-2022-high-v0.6.0-candidate",
  "middleReleaseId": "kr-2022-middle-v0.6.0-candidate",
  "profile": "bridges",
  "releaseId": "kr-2022-middle-high-bridge-v0.6.0-candidate",
  "rightsStatus": "cleared",
  "sourceManifest": "../shared/source-manifest.json",
  "status": "candidate"
}
